{
  "schema_version": 1,
  "chapter_id": "season_08",
  "version": 1,
  "title": "شهر زیر شهر",
  "subtitle": "فصل هشتم",
  "language": "fa-IR",
  "minimum_game_version": "0.1.0",
  "synopsis": "نقشهٔ زیرزمین بالاخره به کار می‌آید. زیر شهر، راهروهایی هست که آب و هوا را جابه‌جا می‌کنند. گروه باید دریچه‌ها را به ترتیب درست باز کند، از خطرهای ساده و قابل پیش‌بینی محیط بگذرد، و در تالار مرکزی بفهمد چرا دستگاه برج از کار افتاده است.",
  "narrative_goal": "ثبت مسیرها روی نقشه، فعال‌کردن دریچه‌ها و رسیدن به تالار مرکزی.",
  "macro_clue": "علت خاموشی دستگاه",
  "primary_environment": "تونل‌ها و تالار زیرزمینی",
  "core_mechanic": "نقشه و اکتشاف",
  "start_scene_id": "S08-E01-SC01",
  "default_ending_id": "ending_s08_mapped",
  "episodes": [
    {
      "episode_id": "S08-E01",
      "title": "ورودی",
      "summary": "گروه دریچهٔ ورودی را پیدا می‌کند و وارد تونل می‌شود."
    },
    {
      "episode_id": "S08-E02",
      "title": "دریچه‌ها",
      "summary": "گروه دریچه‌ها را به ترتیب درست باز می‌کند."
    },
    {
      "episode_id": "S08-E03",
      "title": "پلکان سنگی",
      "summary": "گروه از پلکان پایین می‌رود و به تالار مرکزی می‌رسد."
    },
    {
      "episode_id": "S08-E04",
      "title": "دریچهٔ آخر",
      "summary": "گروه تصمیم می‌گیرد جلوتر برود یا با تجهیزات برگردد."
    }
  ],
  "characters": [
    {
      "character_id": "player",
      "name": "تو",
      "role": "عضو تازهٔ گروه"
    },
    {
      "character_id": "arad",
      "name": "آراد",
      "role": "کنجکاو و ماجراجو"
    },
    {
      "character_id": "raha",
      "name": "رها",
      "role": "تحلیل‌گر گروه"
    },
    {
      "character_id": "mani",
      "name": "مانی",
      "role": "مخترع کوچک"
    },
    {
      "character_id": "fandogh",
      "name": "فندق",
      "role": "راهنمای بازی"
    },
    {
      "character_id": "sohrab",
      "name": "سهراب",
      "role": "کارگر تأسیسات شهر"
    }
  ],
  "clues": [
    {
      "clue_id": "CLUE_S08_ENTRANCE",
      "title": "ورودی تونل",
      "body": "دریچه‌ای در حیاط پشتی شهرداری که روی نقشه نقطهٔ شمارهٔ یک است.",
      "category": "object"
    },
    {
      "clue_id": "CLUE_S08_AIRFLOW",
      "title": "جریان هوا",
      "body": "هوا از یک تونل می‌آید و از تونل دیگر می‌رود. یعنی جایی باز است.",
      "category": "observation"
    },
    {
      "clue_id": "CLUE_S08_VALVES",
      "title": "دریچه‌ها",
      "body": "شش دریچه که اگر به ترتیب غلط باز شوند، آب پس می‌زند.",
      "category": "object"
    },
    {
      "clue_id": "CLUE_S08_SOHRAB",
      "title": "حرف سهراب",
      "body": "سهراب می‌گوید این تونل‌ها مال شهرداری نیستند؛ شهرداری فقط رویشان لوله کشیده.",
      "category": "testimony"
    },
    {
      "clue_id": "CLUE_S08_STAIRS",
      "title": "پلکان سنگی",
      "body": "پلکانی که سنگ‌هایش هر ده پله یک نشانه دارد.",
      "category": "object"
    },
    {
      "clue_id": "CLUE_S08_HALL",
      "title": "تالار مرکزی",
      "body": "تالاری گرد با ده طاقچه دور تا دورش.",
      "category": "object"
    },
    {
      "clue_id": "CLUE_S08_BROKEN",
      "title": "قطعهٔ جامانده",
      "body": "جای یک چرخ‌دنده در دستگاه مرکزی خالی است — همان‌اندازه که در کلبهٔ جنگل پیدا شد.",
      "category": "conclusion"
    },
    {
      "clue_id": "CLUE_S08_WHY",
      "title": "علت خاموشی",
      "body": "دستگاه خراب نشده. یک قطعه‌اش را برداشته‌اند و با خودشان برده‌اند.",
      "category": "conclusion"
    },
    {
      "clue_id": "CLUE_S08_NOTE",
      "title": "یادداشت روی طاقچه",
      "body": "«آن را برداشتم تا تا وقتی کسی ده نقطه را نفهمیده، برج نخواند.»",
      "category": "document"
    },
    {
      "clue_id": "Q_S08_WHO_STOPPED",
      "title": "چه کسی دستگاه را خاموش کرد؟",
      "body": "یک قطعه عمداً برداشته شده است.",
      "category": "question",
      "is_question": true,
      "visible_after": "CLUE_S08_BROKEN",
      "resolved_by": "CLUE_S08_NOTE"
    }
  ],
  "clue_combinations": [
    {
      "a": "CLUE_S08_BROKEN",
      "b": "CLUE_S08_NOTE",
      "result": "CLUE_S08_WHY"
    }
  ],
  "endings": [
    {
      "ending_id": "ending_s08_mapped",
      "title": "نقشه‌ای که کامل شد",
      "body": "گروه هر ده نقطه را روی نقشه ثبت کرد. حالا شهر زیر شهر دیگر ناشناخته نیست."
    },
    {
      "ending_id": "ending_s08_sealed",
      "title": "دری که بسته ماند",
      "body": "گروه تالار را دید ولی دریچهٔ آخر را باز نکرد. سهراب می‌گوید بهتر است با تجهیزات برگردند."
    }
  ],
  "scenes": [
    {
      "scene_id": "S08-E01-SC01",
      "episode_id": "S08-E01",
      "scene_type": "cinematic",
      "title": "زیر پاهایمان",
      "background_id": "BG_S08_TUNNEL_ENTRY",
      "music_id": "MUS_UNDERCITY",
      "cinematic": {
        "cinematic_id": "CIN_S08_E01",
        "skippable": true,
        "beats": [
          {
            "text": "همیشه فکر می‌کردیم شهر همان است که می‌بینیم.",
            "audio_id": "VO_S08_E01_NAR_001",
            "background_id": "BG_S08_TUNNEL_ENTRY",
            "seconds": 4.5
          },
          {
            "text": "نقشه می‌گفت نه.",
            "audio_id": "VO_S08_E01_NAR_002",
            "background_id": "BG_S08_TUNNEL_ENTRY",
            "seconds": 4.5
          }
        ]
      },
      "next_scene_id": "S08-E01-SC02"
    },
    {
      "scene_id": "S08-E01-SC02",
      "episode_id": "S08-E01",
      "scene_type": "dialogue",
      "title": "سهراب",
      "background_id": "BG_S08_TUNNEL_ENTRY",
      "music_id": "MUS_UNDERCITY",
      "on_enter": [
        {
          "add_clue": "CLUE_S08_ENTRANCE"
        }
      ],
      "characters": [
        {
          "character_id": "arad",
          "position": "right",
          "animation": "idle"
        },
        {
          "character_id": "mani",
          "position": "left",
          "animation": "idle"
        }
      ],
      "dialogue": [
        {
          "line_id": "S08-E01-L001",
          "speaker_id": "sohrab",
          "text": "این دریچه مال ماست. ولی تونلِ پشتش نه.",
          "audio_id": "VO_S08_E01_SOHRAB_001",
          "animation": "talk"
        },
        {
          "line_id": "S08-E01-L002",
          "speaker_id": "mani",
          "text": "یعنی چه؟",
          "audio_id": "VO_S08_E01_MANI_001",
          "animation": "think"
        },
        {
          "line_id": "S08-E01-L003",
          "speaker_id": "sohrab",
          "text": "یعنی ما فقط رویش لوله کشیدیم. خودش قبل از ما بوده.",
          "audio_id": "VO_S08_E01_SOHRAB_002",
          "animation": "talk"
        },
        {
          "line_id": "S08-E01-L004",
          "speaker_id": "sohrab",
          "text": "با من بیایید. و دست به دریچه‌ها نزنید تا نگفتم.",
          "audio_id": "VO_S08_E01_SOHRAB_003",
          "animation": "talk"
        }
      ],
      "next_scene_id": "S08-E01-SC03"
    },
    {
      "scene_id": "S08-E01-SC03",
      "episode_id": "S08-E01",
      "scene_type": "explore",
      "title": "تونل اول",
      "background_id": "BG_S08_TUNNEL",
      "music_id": "MUS_UNDERCITY",
      "characters": [
        {
          "character_id": "mani",
          "position": "right",
          "animation": "idle"
        }
      ],
      "dialogue": [
        {
          "line_id": "S08-E01-L005",
          "speaker_id": "fandogh",
          "text": "زیر زمین، هوا راه را نشان می‌دهد. ببین از کجا می‌آید.",
          "audio_id": "VO_S08_E01_FANDOGH_001",
          "animation": "talk"
        }
      ],
      "interactions": [
        {
          "interaction_id": "INT_S08_AIR",
          "kind": "examine",
          "label": "جریان هوا",
          "description": "شعلهٔ چراغ به یک سمت خم می‌شود.",
          "rect": [
            0.26,
            0.46,
            0.18,
            0.22
          ],
          "once": true,
          "effects": [
            {
              "add_clue": "CLUE_S08_AIRFLOW"
            },
            {
              "play_sfx": "SFX_CLUE_FOUND"
            }
          ]
        },
        {
          "interaction_id": "INT_S08_VALVES",
          "kind": "examine",
          "label": "ردیف دریچه‌ها",
          "description": "شش تا، با شماره‌های پاک‌شده.",
          "rect": [
            0.52,
            0.48,
            0.2,
            0.22
          ],
          "once": true,
          "effects": [
            {
              "add_clue": "CLUE_S08_VALVES"
            },
            {
              "play_sfx": "SFX_CLUE_FOUND"
            }
          ]
        },
        {
          "interaction_id": "INT_S08_ASK",
          "kind": "talk",
          "label": "پرسیدن از سهراب",
          "description": "این تونل‌ها مال کی‌اند؟",
          "rect": [
            0.78,
            0.42,
            0.14,
            0.32
          ],
          "once": true,
          "effects": [
            {
              "add_clue": "CLUE_S08_SOHRAB"
            },
            {
              "add_trust": {
                "arad": 1
              }
            }
          ]
        }
      ],
      "next_scene_id": "S08-E01-SC04"
    },
    {
      "scene_id": "S08-E01-SC04",
      "episode_id": "S08-E01",
      "scene_type": "dialogue",
      "title": "کدام تونل؟",
      "background_id": "BG_S08_TUNNEL",
      "music_id": "MUS_UNDERCITY",
      "characters": [
        {
          "character_id": "arad",
          "position": "right",
          "animation": "idle"
        },
        {
          "character_id": "raha",
          "position": "left",
          "animation": "idle"
        }
      ],
      "choices": [
        {
          "choice_id": "CH_S08_E01S04_1",
          "text": "از تونلی برویم که هوا از آن می‌آید.",
          "next_scene_id": "S08-E02-SC01",
          "hint": "هوا از جای باز می‌آید.",
          "effects": [
            {
              "set_flag": {
                "s08_route": "airflow"
              }
            },
            {
              "add_trust": {
                "raha": 1
              }
            }
          ]
        },
        {
          "choice_id": "CH_S08_E01S04_2",
          "text": "از تونلی برویم که روی نقشه کوتاه‌تر است.",